id,text
997202998051958789,"In 1999, I became the first member of Congress to take constituents over the Canadian border to purchase low-cost prescription drugs. Working class women, struggling against breast cancer, were able to purchase the same medicine they were using in Vermont for 1/10 of the price. https://t.co/KncFATEKSE"
996409170466430976,Pennsylvania: today you have a chance to support some true progressives who share our vision for the future.
993210837711060993,"If we are going to turn this country around politically, we need to do well in states like Pennsylvania."
992540046069850113,Watch: Rally with John Fetterman https://t.co/qs3E6iNK7U
992456636055916544,"In Vermont, the first Saturday in May is Green Up Day! Vermonters from all over the state will be getting together to clean up their community. Please connect with a local group near you this Green Up Day. 

https://t.co/5RgAzN66hg"
992418474562646016,"Pete D’Alessandro grew up in a union household and he has spent his life fighting for people. Now, we need him in Congress. https://t.co/zjZYrkZu1t"
991030867257634816,"We are finally beginning to win some major victories in reforming our broken criminal justice system which has destroyed so many lives.
https://t.co/eFCLu5XJ8e"
990296111150661632,"Congratulations to the teachers of West Virginia, Oklahoma, Kentucky and Arizona for helping to lead this country forward. In a highly competitive global economy, a nation which does not educate its children properly will fail.  

https://t.co/8mUPdu3zbe"
989593151622074369,"This is not about ME. This is about US. The truth is that the agenda we are fighting for is not only becoming the agenda of the Democratic Party, it is becoming the agenda of America. We are making great progress. Let's keep going forward.
https://t.co/4NFcxKgOpF"
989233125921353728,Neither democracy nor the Democratic Party is well-served when some 700 super-delegates can ignore the will of their constituents and largely control the results of the Democratic Convention. https://t.co/VqLWP6iu38
988491419785494528,"Oregon - Make sure you're registered to vote in the May 15th primary. Registration ends Tuesday (tomorrow), April 24th.
https://t.co/PDYjChbU1w"
988429202167943168,"Thank you to the people around the country fighting to make health care a right. Change does not happen overnight, but it does happen when millions of people stand up to demand it. https://t.co/eyTExLgUsX"
987008549430718464,"Our political revolution means getting real progressives to run for office at every level, in every state, and in every county. When we stand together and fight, we can accomplish anything. https://t.co/DnWEDZ17ww"
981957626241089536,It's unfortunate that some have so degraded our discourse that my recognition of the historical significance of the Obama presidency is attacked. https://t.co/rRc2KVl8Cl
981912190264512512,"Thank you @ChokweALumumba for hosting a great town hall last night. We can, we must and we shall overcome the forces of greed and injustice that are holding us back. https://t.co/UXj3DxO5QD"
981338520265592842,I want to thank the teachers across the country who are saying loudly and clearly that taking care of our kids and schools is more important than giving tax breaks to billionaires and large corporations. https://t.co/nT7pbBBnox
981280405901987841,"I very much look forward to seeing our friends in Jackson tomorrow night, along with @ChokweALumumba to hold a town meeting on where we go in terms of social and economic justice 50 years after the assassination of Dr. Martin Luther King Jr. https://t.co/mP6tSDUIob"
979382769095766016,"We have got to take the fight for economic, social, racial, and environmental justice to every county in every state in this country. https://t.co/8NxfzSyCog"
976314248086384640,"Congratulations to @ChuyForCongress, @ortizstaterep, @AlmaAnaya7th, @beatrizforjudge &amp; @Delia4StateRep. The political revolution will happen when people decide to stand up, fight back, get involved, and run for office. That is exactly what these IL candidates did today."
972924030201180160,"Arizona, if there was ever a time in the modern history of this country where people have got to stand up and fight back, this is the moment! https://t.co/OkbWUZUiuH https://t.co/sOOYtsN9sQ"
972900476084633600,Pathetic that President Trump attacked smart and compassionate @RepMaxineWaters -- both traits alien to him.
972891160577327104,We’re here to bring the Dodgers back to Brooklyn. https://t.co/V5Zrqir9cw
972890661115457537,With a few tweaks I think @YasielPuig had 30 home runs in him this year. https://t.co/sPqphKlOi3
972888990972981248,The rumors are true. I am trying out for the Dodgers. https://t.co/U1DuGOeLdX
972581053671133185,"If we can transform politics in Texas, we can do it in every state in America. Thank you, Lubbock! https://t.co/ComSKMasql"
972569407057727490,"I've never believed in this blue-state, red-state nonsense. Yes, Lubbock voted overwhelmingly for Trump. But any county in this country, which has people who are struggling, can and must become a progressive county. https://t.co/FdpJnywgw1"
972304819816943619,Assault weapons are military weapons designed to kill human beings. They should not be sold in this country.
972304145742008320,"Our message to Donald Trump, perhaps our most important message, is that we will not let bigots divide us up. Regardless of race, religion, gender or sexual orientation, we are going to stand together."
972295009616744448,"If Texans are prepared to work hard, stand up, fight back, talk to people who voted for Trump, make sure that every friend you have comes out and votes — yeah, I believe that Texas can go blue. https://t.co/zxlTSQpYKR https://t.co/miLZ5dZR64"
971768433175138304,".@Marie4Congress has made it clear that she will be a champion for working families. I'm proud to support her campaign. Marie will fight for Medicare for All, a $15 minimum wage, and providing workers with paid sick leave, while protecting Medicare and Social Security."
968958174870102018,"Pastor Tillman, your work as well as all of those I met in Flint is extraordinary. I look forward to continuing to work with you. https://t.co/vCqifwXMcp"
968318267705184256,We should not be selling assault weapons in this country. These weapons are not for hunting. They are military weapons for killing human beings.
967952495321534464,Thank you Mari for joining us today. https://t.co/m25h9z9nQ9
967548776377389056,"Watch our rally in Green Bay, Wisconsin with #NotOnePenny &amp; @TaxMarch tonight at 8pm EST on https://t.co/dWgRIKgZX1 https://t.co/D2hC5Udn5z"
967508632370929665,Saying hello to the people in the Milwaukee Public Market. https://t.co/UixX8oyTTX
966512526161776640,"No one, including Clinton, should ever face meddling from foreign government https://t.co/bMKOAGVQAw"
966482304301453312,Mueller's indictment provides further evidence that the Russian government interfered in 2016. It also shows that they tried to turn my supporters against Hillary Clinton in the primary and general election. I unequivocally condemn such interference.
966457370980376582,What the Russians did in the 2016 election cycle deserves unconditional condemnation. That includes all of their conduct - whether it was active support of any candidate or active opposition to any candidate.
964596068435595264,"It has been clear to everyone (except Donald Trump) that Russia was deeply involved in the 2016 election and intends to be involved in 2018. It is the American people who should be deciding the political future of our country, not Mr. Putin and the Russian oligarchs."
962406715261095937,"Reg E. Cathey was a voice of the political revolution, and someone I had the honor of working with during my 2016 campaign. He will be greatly missed. Jane and I send our deepest condolences to his family and friends. https://t.co/UWHwHcQODM"
958368963502727169,"I will not support any spending bills as long as Trump and Republican leadership refuse to address the crisis they precipitated when they took away the legal status of 800,000 Dreamers."
958367699389775872,"Today, our government is controlled by the most extremist, reactionary, xenophobic, bigoted, and thankfully, in many ways the most inept and incompetent administration in modern American history. https://t.co/w1UYWsDMcV"
958036778799132672,"Pete has spent his entire career fighting for working families and as a champion of progressive values, and I'm convinced that he would be an unwavering advocate in Congress for the people of Iowa. https://t.co/Xoa0yBOPJh"
954856591345569792,"People are more determined than ever to build a nation based on love and compassion, not hatred or division. Congratulations to the women around the world who are once again sending a powerful message of solidarity today. #WomensMarch2018"
951865039237058560,"Republicans in Congress must now summon the courage to stand up to the racist ramblings of our ""stable genius"" president. Democratic and Republican senators must continue efforts to produce a bi-partisan Dream Act to be voted on by the Senate as part of the overall budget deal."
947156400958005254,"Erica Garner was an exceptional young woman. She was a loving daughter, sister, mother, friend. Jane and I send our deepest condolences to the entire Garner family and to all those she has impacted."
944954964555845632,"If I were the Republicans, I would worry very much about 2018.
https://t.co/UQcWla7pST"
941029941797359616,My thoughts on last night’s election in Alabama: https://t.co/6HtPQczR3Q
940789033239744512,Congratulations to @GDouglasJones for his great victory.  Congratulations to the people of Alabama for doing what few thought they would do. This is a victory not just for Jones and Democrats.  It is a victory for justice and decency.
940621174396084224,"Alabama, you have extraordinary power today. By voting for @GDouglasJones, you can stop the Republican Party's plan to usher in major cuts to Social Security, Medicare and Medicaid. https://t.co/TdlRoTmZRX"
939588596356538373,The Democratic Party will not become a vibrant and successful 50 state party until it opens its doors widely to the working people and young people of our country.  I am extremely pleased that the Unity Reform Commission has begun that process.
935706980643147777,The Republican tax bill is a moral abomination that would take away from so many in need to give more to people who already have it all. #TaxDebate
932781561845608448,Attacks against trans people are part of a bigotry which has got to end. We must work together until hatred and discrimination truly have no place in our society. #TDOR
930178970125029376,"The devastation from the earthquake in Iran last night is horrific. My thoughts are with the victims, their loved ones and the communities that must cope with this catastrophe. https://t.co/qLwADPjmKm"
929825929244930058,Progressives didn’t just say no to Trump. They offered an agenda to make our country work for everyone not just the top 1%. https://t.co/t4yPALeCTE
928991707881984000,"At a time when Trump and the Republican agenda are strongly opposed by the American people, it's critical we come together and reform the Democratic Party. https://t.co/F2pCdPBfJd"
928666110588792832,Many people who had not previously been involved in politics won local positions this week. That is what the political revolution is all about. https://t.co/lPA8Rj9GVC
928378345649143808,"The political revolution we're fighting for is to get more people involved in the political process, to run for office and to vote. We're seeing that happen."
928375865809035264,"I want to congratulate everyone who won yesterday – from governorships to the many first-time candidates who won positions in state legislatures, city councils and school boards."
928363924977840129,"Yesterday was a referendum on President Trump, and he lost badly. It’s clear the American people are deeply concerned about his policies and efforts to divide our country up."
927932911160057856,It’s Election Day in NYC. Get out and vote for @BilldeBlasio and Democrats up and down the ballot. https://t.co/z50hRyRolC
927928884405796864,"It’s #ElectionDay, New Jersey. Get out and vote for the Democratic ticket. Then ask your friends to do the same. https://t.co/OXv5faw46k"
927927626013982720,"Atlanta, it’s time to get out and vote for @fortforatlanta. #ElectionDay Find your polling place here: https://t.co/yudlkEz2Fb"
927921336378384385,"It’s #ElectionDay. Get to the polls, bring your friends and vote for the Democratic ticket. Every vote counts. https://t.co/c9UEDRaYBJ"
927918400210423808,It’s Election Day in Virginia. Get out and vote for the Democratic ticket.  Find your polling place here: https://t.co/I0CblDT2J5
927297991794405377,My thoughts are with the victims of Sutherland Springs and their loved ones. No community should have to face such a senseless tragedy.
925779153596579842,"Instead of more tax breaks for billionaires, we must demand the wealthiest people in this country start paying their fair share of taxes."
925471388051431424,My thoughts are with the victims of today’s horrific attack in Manhattan and their loved ones. https://t.co/1zCNc5PiTK
925195724635234305,I was proud to endorse @BilldeBlasio tonight. He is leading the city in a way that brings people together to make a better life for all.
918929151884656650,Why would any country sign such an agreement with the U.S. if they knew a reckless president might simply discard it a few years later? https://t.co/Ly37pM1UKu
918618260047835136,"Trump might be unaware that Puerto Rico is part of the US, but Congress must move as quickly as possible to pass a disaster relief package."
916354507411468294,We can't go back to the days when women didn't have access to birth control because of income. We must keep fighting for women’s rights.
916352620633251840,President Trump has repeatedly demonstrated how little respect he has for women. This is more of the same. https://t.co/Lw3MHaFdr5
916010664933572608,I am deeply disturbed by the inadequate federal response to the devastation caused by Hurricane Maria.
916010441037500416,"As American citizens, Puerto Ricans are entitled to the same response as people of Texas, Florida and elsewhere hit by natural disasters."
915696646859653120,The Republican budget ignores the needs of ordinary Americans but it bends over backwards to protect the interests of the wealthiest.
915418616320921600,Congratulations to Mayor-Elect @WoodfinForBham for running a great grassroots and winning campaign. I look forward to working with him.
915298753870991360,Birmingham – today is the day. @WoodfinForBham is fighting for real progressive change. Get out the vote and make your voice heard. https://t.co/4sbeYSbkQW
915296694648147968,Politicians who gerrymander districts to unfairly gain political advantages are undermining our democracy. https://t.co/Wnn8w452fB
914901553521324033,"There have been more mass shootings than days this year. It is long, long overdue for Congress to take action on gun safety."
914862860496490498,My thoughts are with the families and friends of the victims and all those wounded in the horrific Las Vegas shooting.
913844833680330754,"Republicans' budget would cut Medicare by at least $450 billion, but would give billionaires, including the Trump family, huge tax breaks."
913839753736413184,"At a time of massive inequality, the Republican budget takes from the middle class and those in need, and gives huge tax breaks to the rich. https://t.co/CzwH8FEaVP"
912349733036969985,"No Republican should vote for this disastrous “health care"" bill, and if they do, they will pay a very heavy political price for that."
911325590929756162,"Even with Senator McCain’s opposition to the Republican health care bill, our own opposition is not over. https://t.co/JIvXqcNy1p"
910167226002673664,Make no mistake: thousands will die unnecessarily if the Republican #GrahamCassidy health care bill becomes law. It must be stopped.
909813521881251840,We must work toward making health care a right. But right now our job is to save our current system which Republicans are trying to destroy.
909127378508636160,"Until we put patients over profits, our health care system will not work for ordinary Americans. #MedicareForAll https://t.co/J48Dr5jR6K"
908760101690990592,"A great nation is not judged by its billionaires, but by its compassion. https://t.co/uv0VgPITue"
908036867874082817,How can the United States stand to be the only major country on earth that doesn’t guarantee health care to all people? #MedicareForAll
908033386538848256,Universal health care is a reality in dozens of countries around the world. It just makes sense for the U.S. to do the same. #MedicareForAll
908029585421422592,It’s an injustice for millions of people to be one illness away from financial disaster. We need #MedicareForAll.
908001671992807425,"Most Americans want universal health care. What are we waiting for?
https://t.co/15tfQjQqDh"
907995815511298048,"I've been criticized for saying this, so let me repeat it: Yes, health care is a right of all people."
907645894484426754,Thank you @tammybaldwin. I am proud to be in the fight for Medicare for all with you. https://t.co/yKkpYRkUpe
904801983076421635,Labor Day is a time to remember that for hundreds of years unions have led the fight for equal rights and economic and social justice. https://t.co/JQuIKnFBmx
902309733318709248,"We stand with everyone undergoing oppression and suffering tonight, with people living in fear of white supremacists and neo-Nazis."
902308939102081024,"We stand with the immigrant families who are scared to death, to young people on the DACA program for whom America is their home."
901466933668851712,My thoughts are with all those affected by Hurricane Harvey. Stay safe and find assistance here: https://t.co/HNzDm6acNh
901280388445868032,"By pardoning Sheriff Arpaio, President Trump has once again made clear where he stands: on the side of racism and discrimination."
900017688474472448,"We're live in Portsmouth, Ohio, talking with locals about the opioid crisis. Join the conversation in the comments:
https://t.co/6wkxdUxVbN"
900003837913817088,"LIVE: Join Bernie for a town hall in Ohio to talk about our priorities on health care, wages and infrastructure: https://t.co/6wkxdUxVbN"
899727519460593665,We defeated the disastrous Republican health care plan. Now we must work together to guarantee health care to all. https://t.co/4uGxKpz73S
899726409362550784,WATCH LIVE: Bernie speaks at the @GoodJobsNation rally in Indianapolis to call on Trump to protect workers: https://t.co/w5j1FVh7Hm
899641884498374656,"I am heading to Indiana, Michigan and Ohio this week to make one simple point: ALL Americans are entitled to health care as a right."
899628600575619074,"Join me, Chuck Jones and @GoodJobsNation today in Indianapolis to stand up for good jobs and livable wages: https://t.co/tIABiB9cNC"
898298051537772545,"My thoughts are with the people of Barcelona, the victims of this horrific terror attack and their families."
897521129304330240,"Immigrants should have a rational path toward citizenship, not just a dark corner to hide in. We must vigorously #DefendDACA."
896798462678900736,Our condolences go out to the family of Heather Heyer who was killed by a terrorist as she protested Neo-Nazism and white supremacy.
896448272046460928,The white nationalist demonstration in #Charlottesville is a reprehensible display of racism and hatred. This has no place in our society.
893531481116737537,"Bottom line is: if other countries around the world are providing quality health care to all their people, we can do the same."
890786451448668160,"Republicans are about to vote to let 20,000 Americans die without health insurance. Think about that."
889965021081554950,The vote to proceed on the 'health care' bill is a step toward passing the most dangerous and destructive legislation in our modern history.
887862563056300037,"John McCain is a hero, one of the most respected senators and a friend. The hopes and prayers of the nation are with him and his family."
887141061566636033,In this country we should not be throwing millions off of health insurance. We should be guaranteeing health care for all as a right.
887140772142886915,This is a great victory for the millions who stood up and fought back. I congratulate everyone for their hard work. https://t.co/sieen0V1Sa
885963362617536512,"A great nation isn’t judged by how many billionaires it has, but by how we treat the most vulnerable among us."
885509292505407488,I am pleased to endorse @BenJealous for governor of Maryland. He’s had a lifetime of courageous activism and can speak to every community.
885147302054289408,"Thanks to Obamacare, William can’t be denied health insurance because of his pre-existing condition. Republicans want to change that. https://t.co/C2Vtsztri8"
884898850942717952,The Republican health care bill is an insult to the American people. It belongs in a garbage can.
884209760031178752,"Yes, this bill will be a disaster for working families. But what’s important to @SenateMajLdr is that the top 1% in this country want it."
884193957965639681,How could it be that @SenateMajLdr could be working so hard to destroy legislation which benefited his own state more than any other?
884184398601617408,We're in Kentucky to tell Mitch McConnell: do not take health care from 22 million to give tax cuts to billionaires. https://t.co/lFy2j2md95
884130031349280768,A great nation is not judged its number of billionaires or the tax breaks they get. It's judged by how we treat the most vulnerable.
884128019547291649,"When workers in West Virginia have two or three jobs to stay alive, you don’t take away their health care to give billionaires tax breaks."
884127521578651648,West Virginia’s overdose death rate is the highest in the U.S. We need more funding to address the crisis—not nearly $800B in Medicaid cuts.
884126009007669250,What kind of country are we when anyone could think about cutting help to disabled kids in order to give tax breaks to billionaires?
884123991614541825,This legislation is fatally flawed. No small tweak here or there will undo the massive damage it will cause to West Virginia and the nation.
884120975062822915,How can you draft a bill of such enormous magnitude without one public comment from experts who are most knowledgeable about health care?
884118708125290496,"While the middle class is shrinking, we will not be part of a process which takes from those families to give even more to the very rich."
884114680163315713,Join us in telling Sen. Capito that we will not allow 22 million Americans to be thrown off their health insurance. https://t.co/6PrHcI6XCy
883855974276227072,"Join me tomorrow Morgantown, West Virginia, to tell Republicans not to take away the health care of millions:
https://t.co/FbVSh2ImM5"
883825091611635712,Thank you @DonnaFEdwards for sharing your story. The issues you raise are true for people all across America. https://t.co/2nXtY8sVZo
883456600173891584,"Unbelievably, when Kentucky has made huge progress on health care, @SenateMajLdr would throw over 230,000 Kentuckians off health insurance."
883383663999811584,Join me for a rally in Kentucky on Sunday to make your voice heard in the fight to protect our health care: https://t.co/zVy0RT6IIy
883054196039311360,How could any Republican senator vote to destroy the Affordable Care Act when it has helped so many of their constituents?
882303968407416832,Happy 4th of July! https://t.co/n4vu6U3hd6
882284594095161344,Happy Independence Day! Read the Declaration of Independence here: https://t.co/ok5mwYLHlr
881901601241300993,"We may disagree on where to go with health care, but there should at least be open debate. Not just decisions made behind closed doors."
881890528790552577,Let's not forget that Sen. McConnell still refuses to hold one hearing on the health care bill that would throw 22 million off insurance.
880796075241738240,Remember this is the wealthiest country in history. We should not have children in poverty. We should not have people without health care.
879466810512482306,People who can't afford health care do not deserve to die.
879444425046360064,The CBO analysis of the disastrous Trump-McConnell health care bill gives us 22 million reasons why it should not see the light of day. https://t.co/CZTBw3tsuY
878999798468268032,"We are in Columbus to say to Sen. Rob Portman: ""Vote NO on the health care bill. Do not take away our care.""
https://t.co/biObhUTJdL"
878995513567326210,"Join me in Charleston today to tell Republicans they must stop the attack on our health care:
https://t.co/arEfpoIjdO"
878993178187231233,"If this legislation was to pass, there is no question that many thousands of our fellow Americans could die unnecessarily. https://t.co/8DpjrJRmFO"
878984346564263936,"Here's a crazy idea: We should join the rest of the world and guarantee health care to all, rather than take it away from 23 million people."
878762187065577472,"Senator Pat Toomey, we are here to say, ""This is a barbaric and immoral piece of legislation. Vote NO!"" https://t.co/OM7IqMqGvj"
878750677119504384,"Watch live as we rally from Pittsburgh to stop the Republican campaign to take away millions' health care:
https://t.co/7OXYag2fDR…"
878696490289565696,"Join me tonight in Pittsburgh to tell Republicans loudly and clearly to stop the attack on our health care:
https://t.co/eTrQCp55gN"
878659234916904960,Please call on California Speaker @Rendon63rd to reverse his decision &amp; let the Assembly VOTE on SB 562 - the single-payer health care bill! https://t.co/FsGGxZ7Tmp
