id,text
1063552266416898052,"I'm re-introducing legislation in the first week of the new Congress to raise the federal minimum wage from $7.25 to $15 an hour. Doing so would directly benefit over 41 million workers, including over half of African-American workers and nearly 60% of Latino workers."
1063513557449523201,"Medicare for all is an idea that's time has come. It’s now supported by 70% of American voters. In this pivotal moment in American history, we must move forward to guarantee health care as a right. https://t.co/ieX8FQmpdi"
1063196683432009729,"Since Trump's tax cuts were passed, the 1,000 largest public companies have actually reduced employment, on balance. They have announced the elimination of nearly 140,000 jobs — which is almost double the 73,000 jobs they say they have created. https://t.co/wwezohOV1G"
1063167576874856449,We need Medicare for All so that no person in America ever goes bankrupt or loses their life again as a result of the greed of insurance or pharmaceutical companies. https://t.co/UJRnsIuzWz
1063132436706537472,"With over 1.4 million American workers, Walmart is by far our nation’s largest private-sector employer. It’s also one of our nation’s most aggressive anti-union companies with a long history of squelching any and all unionization efforts."
1063096636384129025,"The Walton family of Walmart owns more wealth than bottom 40% of the American people, yet Walmart still doesn’t pay their workers a living wage. I’m introducing legislation today to make Walmart finally pay their workers a living wage. https://t.co/UOecqwfOoR"
1062009631906652166,"Here is the simple truth. Donald Trump, like his friends in Russia, Saudi Arabia and North Korea, is an authoritarian leader who does not believe in democracy. The election officials in FL, GA and AZ must ignore the rantings of this president and COUNT EVERY VOTE."
1061730520206376960,"Today, Veterans Day, we honor the enormous sacrifice and bravery of the men and women who put their lives on the line to defend our country."
1061437464454283264,"Never forget that change comes when the people demand it — in the voting booth, in the workplace, and on the streets in peaceful demonstrations. We must remind ourselves of what’s been achieved in the past, and resolve to do equally great things in the future."
1061425810840698880,The current federal minimum wage of $7.25 an hour is a starvation wage and must be raised. The minimum wage must become a living wage. One job should be enough to live with dignity and security.
1061402792697446401,"Getting big money out of politics is vital, but much more needs to be done to restore our democracy. Notably, we must ensure that all Americans are guaranteed an effective right to vote. Campaign finance reform must be accompanied by efforts to strengthen voting rights."
1061395097433051136,"Our vision for American democracy should be a nation in which all people, regardless of their income, can participate in the political process, and can run for office and be in office without begging for contributions from the wealthy and the powerful."
1061336648988934145,"No surprise. Law enforcement says Rick Scott’s allegation of voter fraud was not based in reality. He, and Trump, are just trying to undermine the results if he loses. Count every vote. https://t.co/GMeTtEVBaK"
1061331407488892928,"The election in Georgia is not only about who becomes Governor. It is about protecting the basic tenets of American democracy. @staceyabrams has run a brilliant and inspiring campaign, overcoming enormous obstacles. Now, GA officials must count every vote. https://t.co/jgrfgIGV0z"
1061322816283467776,"American workers need a pay raise. My $15 an hour minimum wage legislation would increase wages for more than 41 million low-wage workers, almost 30 percent of the U.S. workforce. We need an economy that works for all, not just the few. Let's do it."
1061315300069646336,"Young people are the future of our country. They must continue to stand up, fight for their values and help us create a government which works for all, not just the few. https://t.co/knOAdWdUB0"
1061022105905647616,"The election officials in Florida must not be intimidated by Trump's dishonest, outrageous and anti-democratic outbursts. They must stand up for the democratic process - and count every vote. https://t.co/k6Xmy8b0Ef"
1061005493055971329,"In 2010, Rick Scott won by 1.2%. In 2014, Rick Scott won by 1%. In both cases he wasn’t worried about voter fraud. Now, with a 0.18% lead, he is deeply concerned about ""voter fraud."" What hypocrisy! Count every vote in FL, GA and everywhere else. That's what democracy is about."
1060937305924476929,"While Republicans across the country are trying to suppress the vote and undermine American democracy, election officials in FL, GA and AZ must do their jobs and count every vote. They must not allow the president, a bully &amp; a pathological liar, or anyone else to intimidate them."
1060917534961086465,"The incoming freshman class in Congress is going to be the most progressive freshman class in the modern history of the United States. The political establishment notwithstanding, the future belongs to progressives. https://t.co/q9NdJzi02o"
1060901762020900864,"We are not going back to the days when women had to risk their lives to end an unwanted pregnancy. The decision about abortion must remain a decision for the woman and her doctor to make, not the government. https://t.co/E1EYm3kgEM"
1060687481945968640,"In this pivotal moment in American history, we must go forward to guarantee health care as a right and not a privilege. Medicare for all is an idea that's time has come. https://t.co/fsuNWMq2bR"
1060670806924165130,"We are not going back to the days when women did not have full access to birth control. When it comes to the rights of women, we cannot go backwards. We have got to go forward. https://t.co/j406jFRquX"
1060657881148805120,"We must stand up and fight for DREAMers and pass a DREAM Act that provides a path towards citizenship for these 800,000 young people. https://t.co/eReqjudamq"
1060589573653311488,"Let me be absolutely clear: Donald Trump, Brian Kemp and Ron DeSantis ran racist campaigns. https://t.co/QwZtCe4xh3"
1060244110639095808,"Thank you to the people of Vermont for the strong victory they gave me last night. Representing our beautiful state in the U.S. Senate has been the honor of my life and, in my third term, I will continue to do all that I can to stand up for the rights of working people."
1059965640541437953,"If you're in line, stay in line! https://t.co/aKNxF0CT9q"
1059923744993525760,Every vote matters. I won my first election to become Mayor of Burlington by just 10 votes. Your vote can and will have a profound impact on the future of our country and your life. https://t.co/c9UEDRaYBJ https://t.co/62rsxPQPHR
1059915604767977475,#ElectionDay should be a national holiday!
1059885051331125248,"Jane and I just cast our ballots in Burlington. Together we can end one-party, extreme right-wing rule in Washington and elect progressives across the nation! #VoteWithBernie https://t.co/VSldYFGqNw"
1059864136140632070,"I voted this morning with my wife @janeosanders in Burlington. Vermont, being your Senator has been the honor of a lifetime and I appreciate your support for a third term. https://t.co/0T4q4kEqRR"
1059857738409431040,"Every vote matters. Please vote today and bring friends, family members and coworkers out to vote. Let's see historic voter turnout nationwide. https://t.co/c9UEDRaYBJ https://t.co/96JvH8YP4a"
1059818403744100355,"Today’s election is the most important midterm election in modern American history. Today, we can put an end to the reactionary Trump agenda and improve the lives of working people -- but that will only happen if you make your voice heard and vote. https://t.co/c9UEDRaYBJ"
1059632615077150720,"Four years ago, we had the lowest voter turnout in modern American history. Tomorrow, let's have the highest voter turnout in modern American history. https://t.co/l7kI4pYddC"
1059623031146975232,Our job is to do everything we can on Tuesday to re-elect @DaveZuckermanVT for Lieutenant Governor and @TJforVermont for Attorney General of Vermont. Let's make Vermont the progressive leader of the United States of America. https://t.co/zkfnuGY01i
1059602307627782144,"Democracy is not a spectator sport. We must all make plans to vote and to bring friends, family members and coworkers out to vote. Let's stand up for justice. Let's stand up for democracy. Let's win on Tuesday. https://t.co/c9UEDRaYBJ"
1059540135233159170,"71% of American voters believe that Roe v. Wade should not be overturned. We must elect candidates across the nation who will fight for reproductive freedom, justice and equity. https://t.co/hYKSYzVNEK"
1059520861881987072,"There is no doubt in my mind that Republicans will once again attempt to repeal the ACA when they return to Congress as well as try to slash Medicare, Medicaid and Social Security. We can't let them. Let’s get out and vote in record numbers from coast to coast."
1059515451926110208,"Let us show Trump at the ballot box that we reject his constant efforts to divide us up by race, religion, national origin and sexual orientation. We must stand together and create an America that works for all of us."
1059472774949953537,The young people of this country have the power to transform their future and the future of their children and grandchildren. This is your moment—but only if you take advantage of it. Find your polling place here: https://t.co/D4pZ9NH9zb
1059263612311818241,"One job should be enough to live with dignity and security. A job should lift workers out of poverty, not keep them in it."
1059259708362706944,"Thank you, Manchester. It was great to be back in New Hampshire and to see so many wonderful people energized and ready for progressive change. https://t.co/98TLYR9U1i"
1059251228524326913,BERNIE LIVE IN BURLINGTON: Watch Senator Sanders live at the University of Vermont https://t.co/Y92MAYSU5G
1059243864131862529,"Trump is getting very, very nervous because he knows with your help on November 6th, @AndrewGillum is going to be elected the next governor of Florida. https://t.co/WqNgJfFL3E"
1059215666652332032,"Thank you to the students of the University of New Hampshire for having me this afternoon. It is my belief that the young people of this country are the most progressive generation in American history. If you vote in historic numbers on Tuesday, you will transform this nation. https://t.co/Vlo56HEpUr"
1059133519740452869,It was great to be in Montpelier this morning with many incredible candidates running up and down the ballot in Vermont and to see so many people energized and ready to fight for justice for all. Let’s win on November 6th! https://t.co/F09t1BCqzz
1058922975737593856,I moved to Stannard when I first came to Vermont. I’ve visited 13 states in the last 3 weeks but coming home to Stannard was very special to me. https://t.co/muk1Ps4mzh
1058900742260645893,"Thank you, Grand Isle and Enosburg. Our job is not to divide; our job is to bring people together. https://t.co/fFFI0XQ307"
1058830165952921600,"Our job is to do everything we can to get people involved in the political process. Instead of having the lowest voter turnout in modern history, let us do everything that we can to have the highest voter turnout. https://t.co/Oe2ssinHuw"
1058813501546946560,This is a pivotal moment in American history. Let us rise to the historic occasion and do everything we can these next 4 days to end one-party rule in Washington and elect progressives from coast to coast.
1058526149461053440,"I urge you all to never underestimate the value of your voice, the power of your vote, and the potential that comes from people organizing around issues they care deeply about. What seems impossible can be made possible when millions of people stand united."
1058511089955160065,"If people under 30 voted at the same percentage as the rest of the general population, they would transform America. You have extraordinary power to shape the history of this country. https://t.co/VMw8MA6kHR"
1058501899517915137,"BERNIE LIVE: Watch Senator Sanders discuss the importance of having a historic voter turnout in this midterm election.
https://t.co/Ncnppx1Yps"
1058468890454474755,"Trump's top economic advisor said the federal minimum wage is a ""terrible idea."" Unbelievable. https://t.co/MwoR1PSFR6"
1058419639192051717,I'm on @reddit_AMA right now answering your questions about the election on Tuesday - the most important election of our lives. AMA! https://t.co/OgkrFL2ofh https://t.co/nsn7YPfIkH
1058413167573909506,I'll be on @reddit_AMA at 2 p.m. EST to talk about the upcoming election. Ask me anything! https://t.co/OgkrFL2ofh
1058387987841593349,"We are one people who share a common humanity. And we say to Trump today, we are not going backwards into more discrimination, we are going forward to celebrate our diversity. https://t.co/N2oQHj13fm"
1058373994821443589,"To the young people of this country: Your generation has the power to change America. If there were ever a time in history for a generation to be bold and think big, the time is now. https://t.co/8ttsSwcsnl"
1058371999347683328,Take a minute to watch the powerful speech @Oprah gave to rally people to vote for @staceyabrams in Georgia. https://t.co/rToK3h800l
1058122670515109888,"It is not an exaggeration to say that lives are at stake in this election.

This is about whether tens of millions of Americans will keep their health care or whether Republicans will take it away."
1058116933810176000,"Remember: This is how Republicans celebrated when they passed a bill to let thousands of Americans die without health care so that billionaires could get tax breaks. 

Make a plan to vote: https://t.co/c9UEDRszth https://t.co/itKt9r6tuj"
1058107704932229120,"A job must lift workers out of poverty, not keep them in it. The current federal minimum wage of $7.25 an hour, which hasn't been raised since 2009, is a starvation wage and must be raised to a living wage."
1058044142910091264,We must all rise to the historic occasion and make sure we have record voter turnout so we can transform this nation. https://t.co/8GYV9Zyo11
1058002587448942592,"AT&amp;T CEO Randall Stephenson promised to create ""7,000 good jobs for the middle class"" after Trump's tax cut was passed, yet the company has been laying off thousands of workers and shipping those jobs overseas to countries where workers can be paid less than $2 an hour. https://t.co/rG3ANWIsA3"
1057762663760052225,In campaigns and in life in general you're going to have to do things that make you uncomfortable. But that's okay because this is how we grow. https://t.co/dTAFpb3LPT
1057755352408711168,"If our country could bailout Wall Street in 2008, we can make public colleges and universities tuition free throughout the country."
1057747535522078721,"Let us not forget that just 2 weeks ago, Mitch McConnell stated he wants to cut Medicare, Medicaid and Social Security if Republicans keep one-party rule in Washington. We must expand, not cut, these programs that are life and death for the working class in this country."
1057747362423209987,We just marched hundreds of Floridians to the polls. This is the most important midterm election in our history and we must elect @AndrewGillum on Tuesday! https://t.co/h4hBpnARy6
1057729035197919232,"New York City has the opportunity on Election Day to help us end billionaire domination of American politics. 

If Question #1 passes, it will be an example to the country of strong and sensible campaign finance reform. Let's do it!"
1057694349503406080,Change comes when the people demand it. It's an honor to be marching voters to the polls today in Orlando for @AndrewGillum. Let's #BringItHome! https://t.co/nEWIRhW8QZ
1057681503155617792,I’m excited to announce I’ll be doing a Concert Rally to get out the vote at the University of Vermont this Sunday Nov 4th at 7PM with music by @KatWrightBand and @krisgruenmusic. This event is free but tickets are required for entry. https://t.co/05uUmUDUTI https://t.co/5rH24FsTKO
1057661635391832065,We must revitalize the trade union movement in this country and give immigrant workers the power to fight for the decent wages and benefits they deserve. This fight is one that must be carried forth in every state. https://t.co/CslHih6c7K
1057413636212342784,"In striving to be a moral and just society, it is critical that we have the courage to stand with the poor, the vulnerable and with working people, and be willing to stand up to the very powerful and those who seek to divide us up by race, gender, sexuality and nationality."
1057345613208186880,"Steve King should not be a member of the United States Congress.

Iowa: this is your chance to have real leadership. Elect @Scholten4Iowa next week! https://t.co/EThAgqwQ9m"
1057344102499541007,"7 days.

When we stand together and demand that this country works for all of us rather than just the few, we can transform America. Let’s do everything we can these next 7 days to make that happen."
1057326354843267075,We cannot allow ourselves to be divided by the anti-immigrant and xenophobic hysteria Donald Trump and many Republicans are ginning up. We must stand up to racism and bigotry and continue to stand with immigrants while pushing for comprehensive immigration reform.
1057319033404567552,"The Koch brothers are spending millions of dollars trying to defeat @tammybaldwin in Wisconsin. But I've got some bad news for them: Tammy has the people. If you vote, she will win! https://t.co/2OpJuVFoyB"
1057312470044426240,"I’m excited to announce I’m returning to Florida tomorrow to campaign for @AndrewGillum in Orlando and Tampa. Let’s #BringItHome!

Orlando at 11:30AM: https://t.co/AWnRM4LZa1
Tampa at 3:30PM: https://t.co/3WJN5dmmbk"
1057046537317048320,It should be repeated every hour of every day until Election Day that Donald Trump and the Republican leadership in Congress made throwing 32 million Americans off of health insurance their number one priority in Washington.
1057038156011311105,"It’s an international embarrassment that the United States of America is the only -- only -- major country on earth that does not provide paid family and medical leave. Together, we must change that."
1057026391517085702,"8 days.

The time is now to make sure we have historic voter turnout and to stand up, fight back, and to help build a country that works for all of us."
1057017847602388992,In 2014 just 16 percent of young people turned out to vote. We can and we must do better than that. https://t.co/xMA8nA2pBR
1056969751501697024,"It is absurd that in the richest country in the world, people with insurance still have to spend $20,000 out of their own pocket to defeat cancer. We need to pass Medicare for All. https://t.co/ntyupNnBVb"
1056934914250207232,"Steve King, is the leading anti-immigrant xenophobe in Washington. This is the year we defeat him and elect @Scholten4Iowa! https://t.co/oAshzJOQrs"
1056670125909250053,"Today, I would like to endorse some of the ballot measures in states across the country. 

California: Proposition 10
Florida: Amendment 4
Colorado: YES on Amendment 73 and Proposition 112 and NO on Amendment 74
Massachusetts: Question 1
Washington: Initiative 1631

Thread 👇 https://t.co/oi31t5asMP"
1056668429866827776,"""We have to end the legacy of oppression in this country and one way we can do that is with our vote."" – @kendrick38 https://t.co/9Q7W4jhozc"
1056629921072721920,"I’m excited to announce I’ll be doing three rallies in Vermont next Saturday Nov 3rd with great progressives from up and down the ballot in Grand Isle, Enosburg and Stannard.

Grand Isle: https://t.co/vxcVCVGkcA
Enosburg: https://t.co/WNcr0XClXK
Stannard: https://t.co/YBb1Ts56Rg"
1056610899673444352,"It was great to be in Berkeley, California yesterday with @BLeeForCongress. When people stand together, and are prepared to fight back, there is nothing that can’t be accomplished. https://t.co/FKfHGH6BJi"
1056555624169988097,We have got to end the bigotry and hatred that is sweeping this country. https://t.co/v7CYBjII2d
1056244479966040064,I am deeply saddened by the news of a shooting at a synagogue in Pittsburgh. Several years ago a hateful person walked into a church in Charleston. Today there was another act of violence – this time at a synagogue.
1056027353766395904,"Thank you, Oceanside. Let's go forward and do everything we can to flip California's 49th congressional district and elect @MikeLevinCA to Congress. https://t.co/Gml7QVwpvy"
1056025017937469441,"If we can afford to give $1 trillion tax breaks to the richest and most powerful people in this country, you damn well better believe we can afford to make public colleges and universities tuition-free."
1055983885476073472,We have the most important midterm election in the modern history of the United States coming up in 11 days. We must do everything we can between now and then to elect strong progressive leaders from coast to coast.
1055966303775850496,"Paul Ryan is everything that is wrong with the Republican party. He wants to cut Social Security and Medicare to pay for massive tax cuts for billionaires.

That is exactly why we must defeat Ryan's hand-picked successor and elect @IronStache to Congress. https://t.co/uF6PSN9cOK"
1055954393856647169,"Four years ago, in 2014, we had the lowest voter turnout since World War II. In 2018, we have to turn that upside-down. If we continue to fight for each other — for economic, social, racial and environmental justice — we will win in November and beyond."
1055942581539008514,It was an honor to be on the picket line today with @UNITEHERE30 in San Diego. The fight you are waging and the courage you are showing here is exactly the fight that must be waged in every state in this country. One job should be enough for people to live with dignity. https://t.co/uu1HuFV0bA
1055938776378179584,"What we are saying to Westin, Marriott and every corporation that makes billions of dollars in profits is: Pay your workers a living wage! #MarriottStrike https://t.co/Sr7nA81CBr"
1055924861162438656,"One thing I learned at my first union job at a young age is that one worker alone can beg for a wage, can beg for decent working conditions, can beg for some retirement benefits, but when people stand together they don’t have to beg. They can win what they rightfully deserve."
1055921488140865537,Standing with workers on picket lines is something I've done my entire life-- that's what I do and what I believe. Unions are my family. https://t.co/9x8EIe4Cpk
1055898940183400448,"Marriott made $3.4 billion in profits last year and its CEO made over $13 million. Meanwhile, Marriott workers are struggling to make ends meet. I stand with Marriott workers fighting for safe working conditions and a living wage. https://t.co/jGjA86RsCf"
1055888195320078337,"If young people vote in this election, they will transform America. https://t.co/qTFcSadVCb"
1055868478048100352,"Billionaires made more money in 2017 than any other year in history.

To the billionaire class I say: you can't have it all. You can't get huge tax breaks while children in this country go hungry. Your greed must end."
1055621545123594245,"We create change when we demand change. Women’s rights, civil rights, LGBTQ rights, and workers’ rights were all advanced through collective struggle. We must remind ourselves of what’s been achieved in the past, and resolve to do equally great things in the future."
1055566912770531328,"Nearly 70% of young Americans agree we need to make public colleges and university tuition free. If other countries can take this action, so can the United States of America. https://t.co/3rzUag9ODw"
1055555828651057157,Thank you Reno for turning out to support @RosenforNevada. Let's do everything we can these next 12 days in Nevada and nationwide to send her to the Senate! https://t.co/uRRRFF2GTO
1055542504865447936,"I know this will shock all of you, but Donald Trump is lying when he says that Medicare for All will hurt seniors. It will do the exact opposite. https://t.co/4D9Sa8kib3"
1055507453310320641,"12 days.

Let's do everything we can these next 12 days to make sure we have historic voter turnout this election.
 
When millions of us stand together, there is nothing we cannot accomplish."
1055475839356198913,"Donald Trump likes to talk about a ""booming economy.""  This is not a ""booming economy"" when you have people working 2 or 3 jobs, making $8 an hour just to put food on the table. https://t.co/g1lraQkPHi"
1055460101006475264,We must end US support for the Saudi-led war in Yemen and send the message that human lives are worth more than weapons manufacturers' profits. https://t.co/mEjapfdJYr
1055279875542736896,"Colorado, thank you. Let's go win this and make @PolisForCO the next Governor of Colorado! https://t.co/tnXySieVxS"
1055274143355207681,It's time to end the obscenity of women only earning 80 cents on the dollar compared to men. They deserve the whole damn dollar.
1055259708053803008,"Young people are the most progressive generation in American history. If you vote, you will transform this country. https://t.co/fSpy9HTnGr"
1055216110470082560,"Instead of giving $1.5 trillion in tax cuts to the wealthy and large corporations, we should be reducing student debt and making public colleges and universities tuition free. https://t.co/Qp4jyKF7FM"
1055204367702417412,"Thank you, Boulder! Let’s transform Colorado and this nation and do everything we can to make @PolisForCO the next Governor of Colorado. https://t.co/g6jH24RHKQ"
