id,text
1130954751011692544,"Instead of recognizing and addressing the concerns of workers, American Airlines has moved to sue @MachinistsUnion. Machinists keep passengers safe and on time. My message to American Airlines is simple: Stop the intimidation and bullying! https://t.co/YIPu3gGZ0W"
1130930375319064577,"Instead of criminalizing reproductive health care, state legislatures must protect a woman's constitutional right to choose. I applaud the Nevada Legislature for voting today to remove outdated criminal penalties for abortion from state law. https://t.co/QzpaibnEB7"
1130922380384247810,"Philadelphia: get out to vote today for progressive judicial candidates, and bring your friends, family, and neighbors out to vote! Today you can prove to the world that a revolution in criminal justice is possible in America. https://t.co/EO7LipPwP2"
1130887507405692935,"Abortion is health care, it is a woman’s constitutional right, and people in every state in this country are ready to defend that right. Together, we are going to #StopTheBans and end the attacks on women's rights."
1130833256826494981,"Walmart workers are sick and tired of being paid poverty wages, while the Walton family is worth over $170 billion. I’m honored to have been invited by Walmart workers to demand they have a seat on the company’s board. https://t.co/hIYWI3hSbw"
1130632103421521922,Congratulations to newly elected @ATUComm President John Costa — a true rank and file leader with nearly two decades of experience and a commitment to transportation workers and riders.
1130625731162234884,"A few short years ago, we were told that paying workers a living wage of $15 an hour was “too radical.” Not so radical anymore. Now it is time to turn our vision into reality. https://t.co/YxhVWEXqZS"
1130612918989545472,"Why is it that we allow charter schools to siphon public money out of public schools — often with worse results — simply to enrich Wall Street executives, Silicon Valley CEOs and billionaires like the DeVos family?"
1130595526683107333,"Since the late 1980s, the number of racially segregated schools has more than tripled.

This segregation isn't by accident—it's the result of policy decisions made in courts, in state legislatures and in Washington.

I will not tolerate still having separate and unequal schools."
1130557555896389632,"Today I met Pamela Rush in Tyler, Alabama. Her daughter has trouble breathing at night because of mold in their home and there is sewage runoff in her backyard. Pamela is not alone. This is the reality for millions of Americans, but you don’t hear that in Congress or on TV. https://t.co/GmULfL92r1"
1130539728069988352,"I'm in Montgomery, Alabama, holding a town hall to discuss how we can come together in the fight for economic, racial, environmental and social justice. https://t.co/rmjpUj6Obo"
1130504934884085761,"Ford got nearly $750 million in tax breaks from the Trump tax scam and paid its CEO $18 million last year.

Now, Ford is laying off thousands of workers.

The bottom line: Republicans sold the tax scam as a way to create jobs and help workers. They lied. https://t.co/uCoJ5g0PPP"
1130264655077740544,I was proud to stand with those marching in Birmingham today against the outrageous and unconstitutional abortion ban passed in Alabama. We will fight back and protect a woman's right to control her own body. https://t.co/QZUFZaraCK
1130240249651761152,"As president, I will not appoint anyone to the United States Supreme Court unless they are prepared to defend Roe v. Wade. https://t.co/X1jSxrIqUx"
1130226980140404737,We're in Alabama to say: Abortion is a constitutional right. We will not allow states to take away a woman's right to control her own body. Join us as we take a stand in Birmingham. https://t.co/flEMuNtl9J
1130214186355691521,Pamela Turner should be alive today. @ninaturner is right: “There is something wrong in this country when black men and black women can’t get the same justice as everyone else.” https://t.co/XRMVXXHKQj
1130153524770299904,"In South Carolina, unbelievably the standard, according to the state Supreme Court, is that children only get a “minimally adequate education.”

How disgraceful is that!

We are going to guarantee every kid in America an excellent education, not a ""minimally adequate"" one. https://t.co/DlfJlZqCov"
1129888967841767424,"There is something profoundly wrong when billionaires receive tax breaks, while kids go to school in overcrowded, under-staffed, and under-funded classrooms. That is something we are going to change. https://t.co/0aEAlenMnT"
1129861993215619072,The governor of Georgia recently signed a law that would outlaw abortion before many women even know they’re pregnant. We are here in Augusta to say: We will not allow states to take away a woman's constitutional right to control her own body. https://t.co/LDHv96MJ67
1129820276466700288,"It's not just Flint. People in Denmark, South Carolina, have not had clean drinking water for more than a decade because the state government pumped a dangerous chemical into the city’s water supply. We are here to demand action. https://t.co/FrzjEUpedw"
1129804443149406208,"Can you imagine traveling 20 miles every month to collect clean drinking water? That is what people here in Denmark, South Carolina, have to do because the state government pumped a dangerous chemical into the city’s water supply. https://t.co/WIHsV3YkmI"
1129795937583423488,"If I'm elected president, we'll create a national minimum that must be spent per-pupil to educate our kids.

No matter where you live, whether your community’s property values are high or low, your kids' schools will be guaranteed a certain minimum level of education funding."
1129791583220588546,"If we are a nation that can pay baseball players hundreds of millions of dollars, don't tell me we can't afford to pay teachers the salaries they deserve. https://t.co/pQVix0iX9a"
1129772719262896129,"Thurgood Marshall said that all children have a right “to an equal opportunity to reach their full potential as citizens.""

In my view, the only way to accomplish that goal is to guarantee every person in our country a quality education as a fundamental human right."
1129771175066972161,"All over America teachers are telling us that they should not have to work two or three jobs just to make ends meet.

When we defeat Trump, we are going require states to pay teachers a solid starting salary, and that includes cost-of-living increases."
1129770206950244354,"The @NAACP has been demanding a ban on for-profit charter schools and a moratorium on federal funding of new charter schools until we can ensure they’re operating with transparency and accountability.

I agree. As president I will institute that ban and implement that moratorium."
1129768277666914304,Betsy DeVos is the worst Secretary of Education in the modern history of our country. We need an Education Secretary who is a fierce advocate for public education and working class children and works to integrate our schools—not who is doing everything she can to undermine them.
1129764614126919681,"Out of 35 major countries the U.S. ranks 30th in math, 24th in reading, and 19th in science.

Let me be as clear as I can: as the wealthiest country in the history of the world there is no reason we shouldn't have the best education system in the world."
1129762801298432000,"I'm the son of an immigrant who came to this country without a nickel in his pocket.

Our family didn’t have much money, but I was lucky enough to get a good public school education.

The kind of public education I received can and must be a right for every child in America. https://t.co/AawaFSaAky"
1129756537969242112,I am proud to introduce my Thurgood Marshall Plan for A Quality Public Education for All. Read our plan to transform our education system here: https://t.co/3XojUVewly https://t.co/24uvOCjd5x
1129549714519728128,"Thank you New Hampshire State Reps. @JoshuaAdjutant, @SkipCleaver, @ArtSEllison, @CamKenney, @LaborPrez, Ellen Read, @tjsnh and @nashuaward7 and Nashua Alderman-at-Large @brandonlaws1980. Together we will win New Hampshire and defeat Donald Trump. https://t.co/Egp697lKY3"
1129544629743964160,"As someone who did as much as I could to prevent the war in Iraq—the worst foreign policy blunder in modern American history—let me tell you: a war with Iran would be much, much worse. https://t.co/2hPdfAclHj"
1129537835265077249,"It's not an exaggeration to say that banning legal, medically assisted abortion will kill women.

Today we say to the governments of Alabama, Georgia and all the states trying to take away women's constitutional rights: we are not going backwards. We are going forward."
1129529530547286017,"Trump's immigration policy is cruel and un-American. We will reject Trump's attempts to divide us up, and ensure a family-based immigration system grounded in civil and human rights. https://t.co/W90YPIPX0z"
1129528275074727936,"States that had passed a $15 minimum wage four years ago: Zero

States that have passed a $15 minimum wage now: 
California
New York
Massachusetts
New Jersey
Illinois
Maryland
and today, Connecticut

When people see the justice of an idea, it spreads like fire. #FightFor15 https://t.co/nb44Kb5RKP"
1129520727554703360,"On this 65th anniversary of the Brown v Board of Education decision, we are going to tear down barriers for black and brown children and create an education system that works for all people, not just the wealthy and powerful.
https://t.co/OUNxq6PnbP"
1129504907310948352,"Donald Trump thinks he can win reelection by dividing us up. I've got news for him. That's not a path toward victory. We will defeat him by doing the opposite – bringing our people together.  Join us as we continue to fight for justice in Charlotte, NC: https://t.co/HXFvbjWMFn"
1129504133063553025,"Abortion bans in Georgia, Alabama, Ohio and elsewhere are dangerous, regressive, and blatantly unconstitutional. We will fight them in every way possible. https://t.co/l6K8SdHKNC"
1129497081478111232,Donald Trump betrayed working people in Wisconsin and across America. He is a liar and we will defeat him and put working people first. https://t.co/bE7KaFmBo8
1129470622860500997,"When we talk about fighting for justice, we mean ending institutional racism in all its ugly forms."
1129455693029937152,"LGBTQ Americans are still at risk of being fired, evicted and denied services. In the year 2019, that is totally unacceptable.

I am proud to see the House pass the #EqualityAct so that every LGBTQ person in America is protected from discrimination. This is an historic day. https://t.co/XCLKA60OxF"
1129445251628838913,As president I will stand with groups like the @NAACP and put a moratorium on federal funding of new charter schools until rules are in place to make sure they are operating with transparency and accountability.
1129441800622624769,"Charter schools are led by unaccountable, private bodies, and their growth has drained funding from the public school system. When we are in the White House we will ban for-profit charter schools. https://t.co/LGY3ZaWiVm"
1129427147989311488,"I want to welcome you to a campaign which says that the underlying principles of our government will not be greed, hatred and lies. Those ugly anti-American sentiments of the Trump administration are going to end and end soon. Join us live in Asheville: https://t.co/Ws7BBcmn6j"
1129166113978425345,"I stand with workers from @UPTECWA, @CWAUnion and @AFSCME who are striking to stop outsourcing at @UofCalifornia. Thank you for speaking up to protect health care, research and education at these great public universities. https://t.co/Aj0X8NgB2u"
1129156934991568897,"Trump is proposing to send our nuclear waste to Yucca Mountain. That would be a disaster. We must stop building new nuclear power plants, and find a real solution to our existing nuclear waste problem. https://t.co/O6iO0q1Z2B"
1129145096996302850,"A war in Iran would make the Iraq war look like a walk in the park. It will be an unmitigated disaster.

Tell Congress to pass legislation that would prohibit Trump from taking military action against Iran without Congressional approval: https://t.co/zzwVU8sech"
1129136138575319047,"Thank you @JoshShapiroPA for standing up to stop predatory companies from profiting off the student debt crisis. When we are in the White House, we are going to end this kind of greed. https://t.co/VRuJWO9iyV"
1129112838285537281,The abortion ban in Alabama is not about protecting life. It is about controlling women's bodies. https://t.co/oWTWDrDzVf
1129084341546627075,"3,800%.

That's how much the cost of four-year public college has increased since 1964.

In that time, how many bright young people gave up the chance at a college education because they couldn't afford it?

We will make public colleges and universities tuition-free."
1129052373937213442,"Republican legislators are trying to strip away women's rights state by state. This is a frightening time, but we will not let them win. We will fight back and not only defend women's rights, but expand them. https://t.co/yCy1QIQK9k"
1129045488139948034,"Congratulations to activists in New York for stopping the Williams Pipeline! If we are going to confront the crisis of climate change, we must stop new pipelines and rapidly transition to 100% renewable energy. https://t.co/zC6kZEQkr9"
1129034824201777152,This is shameful. A fourth child has died after being detained by Border Patrol since December. Our job is to provide protection and due process to those fleeing violence and persecution—not to threaten the safety of families and children at the border and tear families apart. https://t.co/TyeZQeR3Vc
1128812309357289473,"In the last 10 years the oil and gas industry spent $700+ million on campaign contributions and $1.5 billion on lobbying.

In return they get hundreds of billions in subsidies every year while destroying the planet.

We must end subsidies and tax breaks for oil and gas companies. https://t.co/K17EAqb26x"
1128804061975842816,In no state in America does support for a total ban on abortion—like Alabama just passed—reach even 25%. The extremist attacks on abortion rights must end. #AlabamaAbortionBan https://t.co/8X9fId1VPR
1128792654643433472,Extremist politicians in every state have worked for decades to ban abortion. We will not let them win. #AlabamaAbortionBan https://t.co/d5DzxVadvg
1128788171150512128,"The governor of Alabama just signed a near-total ban on abortion. What an utter disgrace.

But we will not give up. Donate now to @ARC_Southeast, @AbortionFunds and @YellowFund to help low-income women get support for the abortions they need: https://t.co/483kQ4zDXJ"
1128768767553626112,Millennials aren't struggling because they're lazy or wasting their money on avocados. They face unprecedented economic challenges due to decades of policies to help corporations and the top 1% while leaving working people behind.
1128758330732830720,"When fundamental rights are under attack, we must respond and do the most good that we can. In the wake of the abortion ban passed in Alabama, donate here to three abortion support networks so that low-income women can get abortions and reproductive care: https://t.co/gvKBOPHtRQ"
1128753069888552960,"It's simply not acceptable that a wealthy corporation like Southwest Airlines is switching passenger service work at LAX away from union contractors.

We must support the trade union movement. When unions are strong, the middle class is strong. #PovertyDoesntFly https://t.co/z2dv2Fe4bB"
1128716932205686787,"Abortion is health care.

When we pass Medicare for All, we will be guaranteeing a woman’s right to control her own body by covering comprehensive reproductive care, including abortion."
1128688673879416832,"The attack on women’s rights is happening in Alabama, Georgia and across the country, and we must fight it everywhere. I am proud that my state is fighting back—and I encourage all states to do the same to protect a woman’s right to choose. https://t.co/QnkMgDMz4j"
1128655854973128704,Abortion is a constitutional right.
1128484045120266241,"What Alabama is doing is blatantly unconstitutional and disrespects the fundamental right a woman has to make decisions about her own body.

I say to Gov. Ivey: Veto this cruel bill. Stop the attack on women’s rights. https://t.co/yByOIyJ6XL"
1128450671735394304,"Together, we have raised more small-dollar funds than any other candidate in this race. We will not only defeat Donald Trump, but transform the country and bring millions of people into the political process. Help us get there: https://t.co/BLf8rbHq0L https://t.co/3HE1tF2Xoj"
1128434817278914561,"This billionaire thinks Medicare for All is a ""crazy"" idea. Here's what I think is crazy:

Thousands of Americans die every year because they can't afford health care, while the top 65 health care CEOs made $1.7 billion in compensation in 2017. https://t.co/cvOrnRbGTG"
1128426392994111488,"If we go to war with Iran, we will destabilize the entire region and thousands of Americans and Iranians will die.

I am working right now with my Republican colleagues to stop this disastrous rush to war. https://t.co/qJP5i2bNo3"
1128417201285992449,"AT&amp;T promised to create 7,000 jobs if the Trump tax cuts passed.

Instead, AT&amp;T has cut over 23,000 jobs since the tax scam passed in 2017.

Trump and Republicans betrayed workers. We are going to stand with workers and repeal Trump's giveaways to the 1% and large corporations."
1128400843382767616,"Our campaign is about bringing people into the political process who would otherwise never get involved in order to defeat Trump.

Listen to Episode 6 of #HearTheBern to hear how our campaign is standing up for working people across the country: https://t.co/IT4uq33NZ4 https://t.co/4IyogyO3qY"
1128384369859682305,"Republicans claim a Green New Deal is unaffordable. Here is what's unaffordable: If we don't act, from 2050-2100 climate change will cost the U.S. economy $85,000,000,000,000. https://t.co/UuvxBpSjAn"
1128376935594127360,"We must build a world based on peace and justice, not war and destruction. We must invest in our people, not spend unlimited money on endless wars. https://t.co/EMWwabwZIh"
1128363502547230721,"The minimum wage would be $33 today if it had increased as quickly as the average Wall Street bonus since 1985. Instead, millions of people are trying to survive on poverty wages, while Wall Street executives get richer."
1128355365861580802,"The American people do not want endless war! We cannot allow Donald Trump and his national security advisor, John Bolton, to drag us into a war with Iran. The American people must stand up to prevent what would be an unmitigated disaster. https://t.co/lt4r5XCcWQ"
1128344453352235011,"There is no other major country in the world where a mom has to pay $3 MILLION for her son's life-saving surgery. Health care must be a right, not a privilege for the wealthy. We are going to pass Medicare for All. https://t.co/k3xiUVKa9t"
1128102932807933952,"It is not a radical idea to suggest that clean drinking water and clean air should be the right of all Americans, regardless of their income or the color of their skin."
1128098882532118528,"It's time to end all subsidies for oil and gas companies.

These companies lied to the American people about the very existence of climate change. They committed one of the greatest frauds in our history.

When we are in White House we'll rapidly transition to renewable energy."
1128072680895283200,Farmers are unable to repair their own tractors or other equipment because of the greed of companies like John Deere. That is truly insane and we're going to end that. https://t.co/kEDmF9nUtb
1128054428668440577,"Delta Airlines is worth billions and paid its CEO $22 million in 2017.

It’s fighting its employees who want to join a union and negotiate for better wages, telling them to buy video games instead.

That is the kind of greed we are going to end. https://t.co/0EBS1Xxa9M"
1128029254116171777,"Not only is Trump denying climate change as president, his buildings are huge polluters. Trump's 8 biggest New York properties emit as many tons of planet-warming gases every year as 5,800 cars.

Climate change isn't a hoax. It's a crisis we must address.
https://t.co/na8XnhVyna"
1127987019391676416,"Nearly half a million people sitting in jail haven’t been convicted of any crime—simply because many accused of a crime can't afford bail.

We must end cash bail as part of reforming our entire criminal justice system. https://t.co/EO7LipPwP2"
1127973228419395585,"1.1 million more Americans lost health insurance coverage in 2018.

When we have Medicare for All, no one in America will have to worry about losing health insurance."
1127956304855744512,"The economy is doing well—for billionaires and Trump’s Mar-a-Lago friends. Meanwhile:

-78% of Americans live paycheck to paycheck
-34 million have no health insurance
-3 families own more wealth than the bottom half

We need an economy that works for all, not just the 1%. https://t.co/iURJwQAIKo"
1127692297301307392,Climate change is not just an environmental issue. It is a racial justice issue. https://t.co/UqR4wYRpES
1127668379249197058,"One out of every three senior citizens in America relies on Social Security for virtually ALL of their income.

I don't think the wealthiest country in history should have seniors living in poverty. Trump wants to slash Social Security. I believe we must expand it."
1127650352017432576,This is an issue of basic survival. We will not continue to allow drug companies to make massive profits while diabetics ration lifesaving insulin because they can't afford it. We will bring down prescription drug costs by 50%. https://t.co/mikFhFXpjk
1127272655365844994,"Our disastrous trade agreements are written by corporate CEOs to benefit corporate CEOs. In the White House we will be supportive of American workers, unlike Trump. https://t.co/aBtb3W8CyU"
1127233805063000064,"Only four large companies control:
-82% of the beef packing industry
-85% of soybean processing
-63% of pork packing
-53% of chicken processing

Monopolization of agriculture is unfair to food producers, consumers and the environment. We're going to change that. https://t.co/x7c6dSguju"
1127210040346251264,"Did you know that from 1911-1967, Americans could bank at their local post office?

At one point our postal banks serviced 4 million customers.

We must ensure all Americans can access basic financial services by allowing every post office to offer basic banking services again."
1127010564201431043,"As the son of an immigrant, I am appalled that Donald Trump laughed about shooting immigrants. The rise of domestic terrorism and white supremacy is being fueled by this racist president. We all must stand together against displays of hate and take action to combat this threat. https://t.co/3X85HIUGVW"
1126961748320423942,"Average annual interest rates on payday loans:

Delaware: 521%
Idaho: 652%
Nevada: 652%
Texas: 661%
Utah: 652%
Wisconsin: 574%

It's time to end exploitative lending that keeps Americans trapped in debt. We will cap interest rates on consumer loans and credit cards at 15%."
1126913543352332288,"Throughout my life, I have always believed that we need a mass movement of people over many years to bring about the change that we need. That is what this political revolution is about—returning power to the people, where it belongs. https://t.co/ZEO0JGufYm"
1126899050555564032,"There is no “middle ground” when it comes to climate policy. If we don't commit to fully transforming our energy system away from fossil fuels, we will doom future generations. Fighting climate change must be our priority, whether fossil fuel billionaires like it or not."
1126871361572495360,"Without a strong, dedicated nursing workforce, no hospital can provide the quality care patients deserve. This #NationalNursesWeek and every week, we say to our nurses: Thank you for the difficult and important work you do, and we are with you."
1126871360863645701,"Nurses and staff at Mercy Health St. Vincent Medical Center in Toledo should not be working 20-hour shifts without decent health insurance, while the CEO of Mercy Health makes $1.7 million.

@UAW nurses and staff in Toledo deserve fair pay, health care and work schedules."
1126634885354074114,"Republicans' efforts to control women's bodies must end! We can defeat this unconstitutional attempt to ban abortion in Alabama, but we need to act now.

Call your Alabama State Senator to stop this attack on abortion rights:  https://t.co/trkVifmXi1 https://t.co/Ska4TIUBCc"
1126624697364426755,"It's been 219 days since Amazon committed to a $15 minimum wage. When will @Walmart finally do the same, and guarantee a living wage of $15 an hour to all its workers?"
1126606568454279169,"Delta told employees to buy video games instead of forming a union. What a disgrace.

Delta's CEO made nearly $22 million in 2017 while paying ramp agents as little as $9/hour.

I say to Delta: Stop trying to undercut workers' right to form a union and negotiate for better wages. https://t.co/8fx30jIfJf"
1126562485102714880,"Banks make record profits discriminating against people of color and denying basic banking services to 63 million adults who are unbanked or underbanked.

We must allow every post office to offer basic, affordable banking services and end lending discrimination once and for all."
1126545928352141318,Congratulations Councilwoman @TaraLSamples for winning her race for Akron City Council! We need more leaders like Tara in Ohio and across this country.
